{
  "schema_version": "1.0",
  "base_sha": "c284e1c7bedf288a10009b98e5f2da525c3ee4bc",
  "head_sha": "baeee428402430fc22338a48e753fff5ffbfbb72",
  "risk_level": "L2",
  "builder_id": "codex",
  "change_digest": "6583f86db5e24064ae8d582f0a6b5549af8c3283f387a6fa2775afa21aa0f905",
  "deps": [
    "evidence/DEP-VAM-002-MEMORY-CHANGE-ENVELOPE",
    "evidence/DEP-VAM-002-CODERABBIT-REMEDIATION",
    "DEP-VAM-002-SEQUENTIAL-MAIN-INTEGRATION",
    "DEP-VAM-002-INDEPENDENT-REVIEW-REMEDIATION",
    "DEP-VAM-002-PUBLIC-READ-SENSITIVITY",
    "DEP-VAM-002-BUILDER-LOCAL-GREEN-PATH",
    "DEP-VAM-002-FULL-SUITE-COMPATIBILITY",
    "DEP-VAM-002-CODERABBIT-CURRENT-HEAD-REMEDIATION",
    "DEP-VAM-002-CODERABBIT-FINAL-REMEDIATION"
  ],
  "rollback_path": "DEP-VAM-002-SEQUENTIAL-MAIN-INTEGRATION/rollback.md",
  "protected_file_review": ".sddgov/reviews/REV-VAM-002.json"
}
